{
  "id": "tl-2024-10-01-iran-strike",
  "date": "2024-10-01",
  "end_date": null,
  "title": "Iranian ballistic missile attack on Israel",
  "category": "strike",
  "countries": [
    "iran",
    "israel"
  ],
  "actors": [
    "Iran",
    "Israel"
  ],
  "verified": false,
  "sources": [
    {
      "url": "https://en.wikipedia.org/wiki/October_2024_Iranian_strikes_against_Israel",
      "publisher": "Wikipedia",
      "published_at": null,
      "accessed_at": "2026-10-18",
      "kind": "reference"
    }
  ]
}
