{
  "id": "tl-2024-04-01-damascus",
  "date": "2024-04-01",
  "end_date": null,
  "title": "Israeli strike on the Iranian consulate annex in Damascus",
  "category": "strike",
  "countries": [
    "israel",
    "iran"
  ],
  "actors": [
    "Israel",
    "Iran"
  ],
  "verified": false,
  "sources": [
    {
      "url": "https://en.wikipedia.org/wiki/April_2024_Iranian_strikes_against_Israel",
      "publisher": "Wikipedia",
      "published_at": null,
      "accessed_at": "2026-10-18",
      "kind": "reference"
    }
  ]
}
